{
  "schemaVersion": "tinjau.scenario-result/1.0.0",
  "scenarioId": "B-confirmed-protect-CONSTRUCTED",
  "role": "CONFIRMED_EVENT_BOUNDED_ACTION_AND_RECOVERY",
  "title": "Confirmed protection on a builder-controlled pool — CONSTRUCTED market leg, replayed evidence",
  "producedBy": {
    "tasks": [
      "T0.2",
      "T2.1",
      "T2.3",
      "T3.3",
      "T4.1",
      "T4.2",
      "T4.3",
      "T4.5"
    ],
    "generator": "docs/buildx-orion-2026/outputs/05-build/frontend-handoff/tools/generate.ts",
    "modules": [
      "apps/server/src/chain/tinjauScenes.ts (buildConstructedProtectWindow)",
      "apps/server/src/market/confirm.ts",
      "apps/server/src/risk/promote.ts",
      "apps/server/src/decision/orchestrate.ts"
    ]
  },
  "provenance": {
    "evidence": "REPLAYED_SOURCE_LINKED",
    "marketLeg": "CONSTRUCTED",
    "marketVenue": "X_LAYER_TESTNET_CHAIN_1952_BUILDER_CONTROLLED_POOL",
    "outcomeOrigin": "CONSTRUCTED_MARKET_INPUTS",
    "preRegistered": true,
    "preRegisteredOutcome": "PROTECT conditional on fresh market confirmation; WATCH otherwise",
    "matchesPreRegistration": true
  },
  "criticalCaveat": {
    "headline": "THIS PROTECT IS NOT A REPLAY RESULT.",
    "text": "The canonical mainnet replay of this exact evidence resolves to WATCH, because its market leg is NOT_CONFIRMED (drawdown 235 bps clears the 200 bps floor but retains only ~10-13% over the hold interval — the pool dipped and bounced). Tinjau reaches PROTECT on NONE of the four frozen replay scenarios. To demonstrate the bounded action and its deterministic recovery at all, the real replayed 8-K evidence was paired with a CONSTRUCTED price path on the builder-controlled testnet pool. Only the market data is constructed: the CONFIRMED verdict is the real confirmation engine's, under its own unmodified thresholds.",
    "canonicalReplayState": "WATCH",
    "canonicalReplayConfirmation": "NOT_CONFIRMED",
    "canonicalReplayReasonCodes": [
      "ANTI_WICK_FAILED",
      "BONDED_EVIDENCE_PASSED",
      "DUPLICATE_SYNDICATION",
      "MARKET_NOT_CONFIRMED",
      "OFFICIAL_FILING",
      "REFERENCE_MARKET_CLOSED",
      "STALE_EVIDENCE"
    ],
    "reasonCodeDiff": {
      "onlyInCanonical": [
        "ANTI_WICK_FAILED",
        "MARKET_NOT_CONFIRMED"
      ],
      "onlyInConstructed": [
        "MARKET_CONFIRMED"
      ]
    },
    "uiRequirement": "Any surface showing this PROTECT must label it constructed, in the same visual weight as the state itself. Presenting it as a replayed outcome would be the single most misleading thing this project could publish."
  },
  "window": {
    "chainId": 1952,
    "pool": "0x3b3942b682bd59383474974127140a3f0b0c2dff946b8164341c4812985a4a8c",
    "fromIso": "2026-08-21T03:26:15Z",
    "toIso": "2026-08-21T03:51:15Z",
    "swapCount": 51,
    "liquiditySource": "BUILDER_CONTROLLED",
    "construction": {
      "openPrice": 100,
      "fallBps": 300,
      "fallSeconds": 600,
      "holdSeconds": 900,
      "intervalSeconds": 30,
      "note": "Price falls 300 bps over 600 s then holds flat for 900 s. Fed to the real confirmMarket."
    }
  },
  "record": {
    "schemaVersion": "tinjau.risk/1.0.0",
    "assessmentId": "0xcfabb7a1f8babcb5ca25140ab630f0697a11c8d61a11751af4705a1da4028de4",
    "assetAddress": "0xa8ddb5cd96b5222afe198316e9a57caa642850d5",
    "tokenSymbol": "wNVDAx",
    "poolIdOrAddress": "0x2a2b11730c2b6d99a58034a869dd810d7300a7b2",
    "state": "PROTECT",
    "reasonCodes": [
      "BONDED_EVIDENCE_PASSED",
      "DUPLICATE_SYNDICATION",
      "MARKET_CONFIRMED",
      "OFFICIAL_FILING",
      "REFERENCE_MARKET_CLOSED",
      "STALE_EVIDENCE"
    ],
    "humanExplanation": "A qualifying official filing passed the bonded-evidence checks and the market independently corroborated the move within the freshness bound, so a bounded fee action is authorised. Market leg: CONFIRMED. Market confirmed on drawdown. The OKX reference leg was unavailable, so this is a single-leg (X Layer pool) confirmation and must not be described as dual-leg. The OKX reference leg was unavailable, so no artifact may describe this as dual-leg OKX/X Layer confirmation. Bounded action PROPOSED (not applied): fee 20000 pips, which is at or below the policy target 20000 for confidence HIGH. The contract recomputes its own target and may lower or reject this proposal; it can never raise it.",
    "evidenceCommitment": "0xcad6db77aa45e876a560caa8d297d4e44b3a6b91075975b7205e079dca4e1f09",
    "confidenceBand": "HIGH",
    "assessedAt": "2026-08-21T03:51:15.000Z",
    "expiresAt": "2026-08-21T09:51:15.000Z",
    "policyVersion": "tinjau.policy/1.0.0",
    "dataMode": "REPLAY",
    "evidence": [
      {
        "claimId": "claim-b-001",
        "sourceClass": "OFFICIAL",
        "dataMode": "REPLAY",
        "sourceUrl": "https://www.sec.gov/Archives/edgar/data/1045810/000104581026000069/nvda-20260817.htm",
        "sourceId": "edgar:0001045810-26-000069/nvda-20260817.htm",
        "publisherOrAuthor": "NVIDIA CORPORATION (SEC EDGAR filer, CIK 0001045810)",
        "publishedAt": "2026-08-21T03:51:15Z",
        "company": "NVIDIA CORPORATION",
        "tokenSymbol": "wNVDAx",
        "tokenAddress": "0xa8ddb5cd96b5222afe198316e9a57caa642850d5",
        "eventType": "MATERIAL_DEFINITIVE_AGREEMENT_AND_DIRECT_FINANCIAL_OBLIGATION",
        "claimTextOrPointer": "Item 1.01 (verbatim): \"On August 17, 2026, NVIDIA entered into multiple residual value guaranties (collectively, the “Agreements”) with SB Energy (the “Lessor”) relating to leases for approximately 4.25 gigawatts of IT load in the aggregate at the Portsmouth Site.\" and \"NVIDIA’s aggregate payment obligation is cumulatively capped at $105 billion for its initial commitment under the Agreements.\"",
        "independenceGroup": "official:edgar/0001045810-26-000069",
        "relation": "ORIGIN",
        "officialConfirmation": true,
        "expiresAt": "2026-08-24T03:51:15Z"
      },
      {
        "claimId": "claim-b-002",
        "sourceClass": "OFFICIAL",
        "dataMode": "REPLAY",
        "sourceUrl": "https://www.sec.gov/Archives/edgar/data/1045810/000104581026000069/sbeoainvidia-portsrelease.htm",
        "sourceId": "edgar:0001045810-26-000069/sbeoainvidia-portsrelease.htm",
        "publisherOrAuthor": "NVIDIA CORPORATION (Exhibit 99.1, furnished under Item 7.01)",
        "publishedAt": "2026-08-21T03:51:15Z",
        "company": "NVIDIA CORPORATION",
        "tokenSymbol": "wNVDAx",
        "tokenAddress": "0xa8ddb5cd96b5222afe198316e9a57caa642850d5",
        "eventType": "MATERIAL_DEFINITIVE_AGREEMENT_AND_DIRECT_FINANCIAL_OBLIGATION",
        "claimTextOrPointer": "Exhibit 99.1 press release announcing the SB Energy partnership, furnished under Item 7.01 Regulation FD.",
        "independenceGroup": "official:edgar/0001045810-26-000069",
        "relation": "SUPPORTS",
        "officialConfirmation": true,
        "expiresAt": "2026-08-24T03:51:15Z"
      },
      {
        "claimId": "claim-b-003",
        "sourceClass": "NEWS",
        "dataMode": "REPLAY",
        "sourceUrl": null,
        "sourceId": "wsj/2026-08-14/nvidia-scales-back-ohio-guarantee",
        "publisherOrAuthor": "The Wall Street Journal",
        "publishedAt": "2026-08-17T15:09:42Z",
        "company": "NVIDIA CORPORATION",
        "tokenSymbol": "wNVDAx",
        "tokenAddress": "0xa8ddb5cd96b5222afe198316e9a57caa642850d5",
        "eventType": "CONTINGENT_FINANCIAL_OBLIGATION",
        "claimTextOrPointer": "As reported by Reuters: NVIDIA has revised its plans and is now expected to initially guarantee less than $120 billion, down from the $250 billion previously discussed.",
        "independenceGroup": "origin:wsj/2026-08-14/nvda-ohio-guarantee-revision",
        "relation": "SUPPORTS",
        "officialConfirmation": true,
        "expiresAt": "2026-08-20T15:09:42Z"
      },
      {
        "claimId": "claim-b-004",
        "sourceClass": "NEWS",
        "dataMode": "REPLAY",
        "sourceUrl": "https://finance.yahoo.com/technology/ai/articles/nvidia-scales-back-250-billion-234356524.html",
        "sourceId": "reuters-via-yahoo/2026-08-14T23:43:56Z/nvidia-scales-back-guarantee",
        "publisherOrAuthor": "Reuters — Mrinmay Dey (syndicated by Yahoo Finance)",
        "publishedAt": "2026-08-18T14:53:38Z",
        "company": "NVIDIA CORPORATION",
        "tokenSymbol": "wNVDAx",
        "tokenAddress": "0xa8ddb5cd96b5222afe198316e9a57caa642850d5",
        "eventType": "CONTINGENT_FINANCIAL_OBLIGATION",
        "claimTextOrPointer": "Attribution (verbatim): \"Nvidia has revised its plans to support a proposed OpenAI data center project in Ohio and is now expected to initially guarantee less than $120 billion, down from the $250 billion previously discussed, the Wall Street Journal reported on Friday, citing people familiar with the matter.\"",
        "independenceGroup": "origin:wsj/2026-08-14/nvda-ohio-guarantee-revision",
        "relation": "DUPLICATE",
        "officialConfirmation": true,
        "expiresAt": "2026-08-21T14:53:38Z"
      },
      {
        "claimId": "claim-b-005",
        "sourceClass": "NEWS",
        "dataMode": "REPLAY",
        "sourceUrl": "https://www.theinformation.com/articles/nvidia-talks-invest-3-billion-sb-energy-part-openai-data-center-deal",
        "sourceId": "theinformation.com/2026-08-15/nvidia-talks-invest-3-billion-sb-energy",
        "publisherOrAuthor": "The Information — Valida Pau, Ann Davis Vaughan, Phoebe Liu",
        "publishedAt": "2026-08-18T15:09:42Z",
        "company": "NVIDIA CORPORATION",
        "tokenSymbol": "wNVDAx",
        "tokenAddress": "0xa8ddb5cd96b5222afe198316e9a57caa642850d5",
        "eventType": "STRATEGIC_PARTNERSHIP_OR_INVESTMENT",
        "claimTextOrPointer": "Headline (verbatim): \"Nvidia in Talks to Invest $3 Billion in SB Energy as Part of OpenAI Data Center Deal\"",
        "independenceGroup": "origin:theinformation/2026-08-15/nvda-sbenergy-3b",